{
  "query": "\nWhat are the latest developments and potential impacts of Retrieval-Augmented Generation (RAG) \nin healthcare applications, focusing on studies from 2023-2025? Consider both technical \ninnovations and real-world implementation challenges.\n",
  "plan": {
    "query": "\nWhat are the latest developments and potential impacts of Retrieval-Augmented Generation (RAG) \nin healthcare applications, focusing on studies from 2023-2025? Consider both technical \ninnovations and real-world implementation challenges.\n",
    "hops": [
      "scoping",
      "retrieval",
      "analysis",
      "verification",
      "insights",
      "reporting"
    ],
    "estimated_cost_usd": 0.6000000000000001,
    "estimated_tokens": 6000
  },
  "claims": [
    {
      "claim_id": "c0",
      "claim": "Modern RAG implementations often combine dense retrieval with lightweight filtering or hybrid search (e",
      "evidence": [
        {
          "id": "f3f3e2cdf219",
          "url": "https://arxiv.org/html/2507.18910v1"
        }
      ],
      "verified": true
    },
    {
      "claim_id": "c1",
      "claim": "g",
      "evidence": [
        {
          "id": "f3f3e2cdf219",
          "url": "https://arxiv.org/html/2507.18910v1"
        }
      ],
      "verified": true
    },
    {
      "claim_id": "c2",
      "claim": ", BM25 + embeddings) to improve recall",
      "evidence": [
        {
          "id": "f3f3e2cdf219",
          "url": "https://arxiv.org/html/2507.18910v1"
        }
      ],
      "verified": true
    }
  ],
  "meta": {
    "generated": "2025-11-08T17:49:19.785610+00:00"
  }
}